{
  "$schema": "../profile.schema.json",
  "dots": { "type": "rounded", "color": "#000000" },
  "cornersSquare": { "type": "extra-rounded", "color": "#000000" },
  "cornersDot": { "type": "dot", "color": "#000000" },
  "background": { "color": "#FFFFFF" },
  "image": "~/.qrgen/assets/default/qrgen-sample.jpeg",
  "imageOptions": { "imageSize": 0.28, "margin": 6, "hideBackgroundDots": true },
  "errorCorrectionLevel": "H",
  "labelColor": "#000000",
  "output": "./"
}
